train,stations
train_1,"[Zaandam, Beverwijk, Castricum, Alkmaar, Hoorn]"
train_2,"[Rotterdam Centraal, Schiedam Centrum, Delft, Den Haag Centraal, Gouda, Alphen a/d Rijn, Leiden Centraal, Heemstede-Aerdenhout, Haarlem, Beverwijk]"
train_3,"[Amsterdam Amstel, Amsterdam Zuid, Amsterdam Sloterdijk, Haarlem, Amsterdam Sloterdijk, Zaandam, Castricum, Alkmaar, Den Helder]"
train_4,"[Dordrecht, Rotterdam Centraal, Rotterdam Alexander, Gouda, Den Haag Centraal, Leiden Centraal, Alphen a/d Rijn, Leiden Centraal, Schiphol Airport, Amsterdam Zuid, Schiphol Airport]"
train_5,"[Amsterdam Amstel, Amsterdam Centraal, Amsterdam Sloterdijk, Zaandam, Hoorn]"
score,9041.0
