,train,stations
0,train_1,"[Amsterdam Sloterdijk, Haarlem, Beverwijk, Castricum, Alkmaar, Hoorn]"
1,train_2,"[Dordrecht, Rotterdam Centraal, Schiedam Centrum, Delft, Den Haag Centraal, Gouda, Alphen a/d Rijn, Leiden Centraal, Heemstede-Aerdenhout, Haarlem]"
2,train_3,"[Amsterdam Zuid, Amsterdam Sloterdijk, Zaandam, Castricum, Alkmaar, Den Helder]"
3,train_4,"[Rotterdam Centraal, Rotterdam Alexander, Gouda, Den Haag Centraal, Leiden Centraal, Alphen a/d Rijn, Leiden Centraal, Schiphol Airport, Amsterdam Zuid, Schiphol Airport]"
4,train_5,"[Amsterdam Amstel, Amsterdam Zuid, Amsterdam Amstel, Amsterdam Centraal, Amsterdam Sloterdijk, Zaandam, Beverwijk, Zaandam, Hoorn]"
5,score,9017.0
