train,stations
train_1,"[Rotterdam Alexander, Gouda, Alphen a/d Rijn, Gouda, Den Haag Centraal, Gouda, Alphen a/d Rijn]"
train_2,"[Amsterdam Zuid, Amsterdam Sloterdijk, Haarlem, Beverwijk, Castricum, Alkmaar, Hoorn, Alkmaar]"
train_3,"[Schiedam Centrum, Delft, Den Haag Centraal, Leiden Centraal, Heemstede-Aerdenhout, Haarlem, Beverwijk, Zaandam, Castricum, Beverwijk]"
train_4,"[Rotterdam Centraal, Schiedam Centrum, Delft, Den Haag Centraal, Gouda, Alphen a/d Rijn, Gouda, Alphen a/d Rijn, Gouda]"
train_5,"[Rotterdam Centraal, Schiedam Centrum, Delft, Schiedam Centrum, Rotterdam Centraal, Schiedam Centrum]"
train_6,"[Rotterdam Centraal, Rotterdam Alexander, Gouda, Alphen a/d Rijn, Leiden Centraal, Alphen a/d Rijn, Gouda, Den Haag Centraal, Leiden Centraal]"
train_7,"[Zaandam, Hoorn, Zaandam, Beverwijk, Haarlem, Amsterdam Sloterdijk, Zaandam]"
score,6095.0
